,index,F0,F1,F2,l1,l2sens,czy_ostatnie,realization,centering,set,target,Unnamed: 10
0,44.0,Werka weszła do mieszkania po długim dniu pracy.,Pogłaskała Łatkę po głowie.,"Werka często tak robiła, gdy zostawiała Łatkę samą w domu.",20.0,0.0,0.0,noun,centered,8,target,
1,,Lilia zakasała rękawy i wzięła się do roboty.,Pomogła sprzątnąć dom Mariuszowi.,Sam by sobie nie poradził z tym bałaganem.,,,,filler,filler40,sensible,filler40,
2,149.0,Daria postanowiła zorganizować wycieczkę.,Wybrała się razem z Kingą na wyprawę górską.,"Kinga zastanawia się, czy spanie w szałasie nie będzie zbyt uciążliwe dla Darii.",25.0,23.0,1.0,noun,noncentered,25,target,
3,,Grzegorz był prawdziwą złotą rączką.,Naprawił ulubiony zegar Jana.,Jego firanki nigdy nie miały dla Jana znaczenia.,,,,pronoun,filler4,nonsensible,filler4,
4,,Krzysztof dostał dużą premię od swojego szefa.,Postanowił zrobić remont w mieszkaniu Dominiki.,"Gdyby Krzysztof nie został strażakiem, Domince starczyłoby na jabłka.",,,,noun,filler18,nonsensible,filler18,
5,55.0,Michał wstał wczoraj o świcie.,Zadzwonił wcześnie rano do Karola.,"On miał ważną sprawę, dlatego chciał szybko skontaktować się z Karolem.",21.0,18.0,1.0,pronoun,centered,10,target,
6,,Gracjan to entuzjasta muzyki elektronicznej.,Jest największym fanem The Chainsmokers.,Chodził na wszystkie ich koncerty.,,,,filler,filler33,sensible,filler33,
7,62.0,Asia lubi wściubiać nos w nie swoje sprawy.,Znalazła na strychu stary pamiętnik Ewy.,"Asia po tym, czego się dowiedziała, nie mogła długo zdobyć się na rozmowę z Ewą.",22.0,0.0,1.0,noun,centered,11,target,
8,,Jan miał znów problemy ze swoim bankiem.,Nie był w stanie wysłać Tadkowi czeku.,"On był tak dumny, że Tadek mógł to zrobić.",,,,pronoun,filler1,nonsensible,filler1,
9,167.0,Adrian usłyszał dzwonek i sięgnął po telefon.,Przeczytał wiadomość od Kacpra.,"Kacper nie może jednak wyjść z pracy wcześniej, by spotkać się teraz z Adrianem.",22.0,0.0,1.0,noun,noncentered,28,target,
10,,"Zuzia miała w życiu osobę, na której zawsze mogła polegać.",Była najlepszą przyjaciółką Justyny.,Wszystko robiły razem i zawsze były ze sobą zgodne.,,,,filler,filler28,sensible,filler28,
11,175.0,Konrad chciał zrobić zakupy na imprezę urodzinową.,Umówił się z Błażejem pod sklepem.,"On siedział pod sklepem godzinę, jednak nie doczekał się Błażeja.",19.0,16.0,1.0,pronoun,centered,30,target,
12,,Klara wyśmiewała ekstrawaganckie stroje Jagody.,Zawsze wytrącała Jagodę z równowagi.,Klara nigdy nie spóźniała się na korepetycje u Jagody.,,,,noun,filler6,nonsensible,filler6,
13,150.0,Igor spóźnił się na lekcję plastyki.,Usiadł w ławce razem z Albertem.,"Był zadowolony, że się udało, bo zawsze bardzo dobrze mu się pracowało z Albertem.",28.0,25.0,1.0,null,centered,26,target,
14,,Lilka szybko odnalazła się w nowym przedszkolu.,Zaprzyjaźniła się z Marianką.,Lubiły bawić się razem lalkami.,,,,filler,filler37,sensible,filler37,
15,71.0,Rafał nie był grzecznym chłopcem.,Często znęcał się nad Grzesiem.,Grzesio w końcu któregoś dnia postanowił poskarżyć się na Rafała.,16.0,0.0,1.0,noun,noncentered,12,target,
16,,"Kasia żałowała, że powiedziała wszystko Janinie.",Straciła zaufanie do Janiny.,"Gdyby nie jej torebka, to Janina miałaby więcej szczęścia.",,,,pronoun,filler2,nonsensible,filler2,
17,8.0,Marzena lubiła sprawiać innym przyjemność.,Często więc komplementowała Zosię.,"Marzena zawsze uważała, że Zosia ma dobry gust.",16.0,0.0,0.0,noun,centered,2,target,
18,,Irenę od pięciu lat dręczyły problemy finansowe.,Odziedziczyła cały spadek po Konradzie.,Stała się z dnia na dzień obrzydliwie bogata.,,,,filler,filler30,sensible,filler30,
19,48.0,Bartek zdenerwowany usiadł do odrabiania pracy domowej.,Z wściekłością wyrzucił Maćka z pokoju.,"Szybko się denerwował, gdy Maciek przeszkadzał mu w pracy.",17.0,8.0,0.0,null,centered,9,target,
20,,Klemens testował nowy przepis.,Gotował razem z Heleną obiad.,Niestety zagapili się i przypaliła im się zupa.,,,,filler,filler24,sensible,filler24,
21,102.0,Hania podczas pieszych wędrówek była bardzo nieuważna.,Zgubiła podczas wycieczki złote kolczyki Julii.,"Będzie musiała przyznać się mamie, że pożyczyła kolczyki od Julii.",21.0,19.0,1.0,null,centered,18,target,
22,,Tadeusz był śmiertelnie zakochany w Marii.,Codziennie pisał wiersze dla Marii.,Według niego najważniejsze było śpiewanie piosenek dla Marii.,,,,pronoun,filler13,nonsensible,filler13,
23,132.0,Olga znów nie odrobiła lekcji.,Przepisała pracę domową od Ani.,"Nie podejrzewała, jakie nieprzyjemności będzie miała z tego powodu Ania.",25.0,23.0,1.0,null,centered,23,target,
24,,Dawid miał ambicje zostania najlepszym matematykiem w klasie.,Marzył o dorównaniu Paulinie.,"Gdy Dawid wchodził po schodach, Paulina patrzyła uważnie.",,,,noun,filler10,nonsensible,filler10,
25,81.0,Staś nigdy nie odmawiał przyjaciołom w potrzebie.,Pomógł Adamowi myć samochód.,"Wiedział, że prawdopodobnie Staś będzie chciał zapłatę.",15.0,8.0,0.0,null,noncentered,14,target,
26,,"Szczepan długo myślał, kogo zaprosić na wesele.",Poszedł na imprezę z Olą.,Według Szczepana największe szanse w maratonie ma Ola.,,,,noun,filler19,nonsensible,filler19,
27,,Zosia nie wiedziała co powiedzieć.,Nie potrafiła doradzić Lucynie.,Problem ten był dla niej zbyt skomplikowany.,,,,filler,filler25,sensible,filler25,
28,119.0,"Basia dowiedziała się, że jej mąż rozbił po pijaku nowy samochód.",W sekrecie powiedziała Oli o wypadku.,"Ola wie, że nie dotrzyma tajemnicy, mimo że obiecała Basi, że nic nikomu nie powie.",23.0,0.0,0.0,noun,noncentered,20,target,
29,,Mikołaj pamiętał o urodzinach swoich bliskich.,Co roku przynosił prezenty Tosi.,On bardzo lubił pleść Tosi warkocze.,,,,pronoun,filler11,nonsensible,filler11,
30,,Staś miał w swoim życiu kilka autorytetów.,Zawsze podziwiał Rafała.,Był dla niego kimś w rodzaju starszego brata.,,,,filler,filler23,sensible,filler23,
31,100.0,Marysia zawsze wyręczała swoich podopiecznych.,Pozmywała naczynia za Sonię.,"Ona musi się nauczyć, żeby nie obciążać swoimi obowiązkami Marysi.",19.0,17.0,1.0,pronoun,noncentered,17,target,
32,,Adrian potrzebował rady w sprawie wystroju mieszkania.,Zawsze liczył się ze zdaniem Gosi.,"Uważał, że ona ma naprawdę fantastyczny gust.",,,,filler,filler34,sensible,filler34,
33,,Teresa była winna Marcie dwadzieścia złotych.,Wrzuciła do skrytki Marty banknot.,"Ona była zawsze umalowana, czego zazdrościła jej Marta.",,,,pronoun,filler5,nonsensible,filler5,
34,93.0,Marcin jest najbardziej skrupulatnym pracownikiem w zespole.,Nie lubi pracować z Hubertem.,"Często bardzo się złości, gdy Marcin stara się mu pomóc.",14.0,8.0,0.0,null,noncentered,16,target,
35,,Tomek od dawna chciał zwiedzić Paryż.,Zaplanował wyjazd z Magdą.,"Jakby Tomek nie zjadł pączka, to Magda nie byłaby zła.",,,,noun,filler17,nonsensible,filler17,
36,157.0,Lena wygląda na bardzo zaniepokojoną.,Nie jest w stanie skontaktować się z Klarą.,"Ona przynajmniej od tygodnia ma zepsuty telefon, więc nie może zadzwonić do Klary.",26.0,24.0,1.0,pronoun,centered,27,target,
37,,Olek nie był dobrym mężem.,Znowu zdradził Franciszkę.,Nie mogła sobie z tym poradzić.,,,,filler,filler38,sensible,filler38,
38,2.0,Jacka męczyły wyrzuty sumienia.,Dlatego szczerze przeprosił Piotra.,Jacek był wczoraj bardzo niemiły dla Piotra.,13.0,0.0,1.0,noun,centered,1,target,
39,,Łukasz pierwszy raz w życiu się zakochał.,Bardzo podoba się mu Natalia.,"Chciałby ją zaprosić na randkę, ale boi się odrzucenia.",,,,filler,filler27,sensible,filler27,
40,20.0,Tomek odznaczał się spostrzegawczością.,Znalazł w szatni zeszyt Kuby.,"Tomek ucieszył się, bo już dawno temu miał go zwrócić Kubie.",18.0,0.0,1.0,noun,centered,4,target,
41,,Kaczor Donald często odwiedzał Myszogród.,Był ulubionym gościem Myszki Miki.,Uwielbiali spędzać ze sobą czas.,,,,filler,filler32,sensible,filler32,
42,,Agnieszka była świetna z chemii.,Pomagała w lekcjach Adamowi.,"Gdyby nie Agnieszka, Adam by chodził w porwanych skarpetkach.",,,,noun,filler16,nonsensible,filler16,
43,76.0,Ala miała tego dnia dużo obowiązków.,Wysłała Kasię do sklepu po zakupy.,"Ona nie mogła znaleźć rzeczy, o które poprosiła ją Ala.",18.0,16.0,1.0,pronoun,noncentered,13,target,
44,,Marcin był najbardziej opanowanym członkiem komisji.,Starał się uspokoić Magdalenę.,"Dla Marcina w miarę postępów było coraz jaśniejsze, dlaczego to Magdalena.",,,,noun,filler8,nonsensible,filler8,
45,142.0,Jurek miał mieszane uczucia po dzisiejszym spotkaniu.,Bardzo pokłócił się z Leszkiem.,"On nie mógł zrozumieć, dlaczego nie może przekonać Jurka do swojego zdania.",24.0,13.0,0.0,pronoun,noncentered,24,target,
46,,Alicja skończył się zasiłek dla bezrobotnych.,Znalazła pracę w firmie Bartka.,Zawsze lubili razem pracować.,,,,filler,filler36,sensible,filler36,
47,171.0,Soni skończył się miesięczny bilet autobusowy.,Pożyczyła rower od Niny.,"Miała później wyrzuty sumienia, ponieważ w drodze do pracy Sonię potrącił samochód.",27.0,19.0,0.0,null,noncentered,29,target,
48,,Zosia nie mogła dłużej znieść kiepskiej atmosfery w pracy.,Zrozpaczona przytuliła się do Maćka.,"Zosia przeczytała ""Lalkę"", którą Maciek omawiał na lekcji.",,,,noun,filler20,nonsensible,filler20,
49,,"Radek wiedział, że w jego dzielnicy jest w nocy niebezpiecznie..",Dla niego najważniejsze było bezpieczeństwo Oli.,Dlatego wysłał ją na kurs samoobrony.,,,,filler,filler22,sensible,filler22,
50,37.0,Wiktor w końcu zawarł oficjalną umowę kupna wymarzonej Yamahy.,Uścisnął na koniec dłoń Pawła.,"On był zadowolony z transakcji, którą zawarł z Pawłem.",18.0,16.0,1.0,pronoun,centered,7,target,
51,,Kacper był doświadczonym tatarnikiem.,Zabrał Sebastiana na wycieczkę.,Sebastianowi podobała się ich wspólna wyprawa.,,,,filler,filler21,sensible,filler21,
52,,Staś był świetny w domowych wypiekach.,Próbował zrobić ulubiony tort Doroty.,"Dobrze robił fikołki, a Dorota lubiła czytać kryminły.",,,,pronoun,filler12,nonsensible,filler12,
53,,Wojtek cały wieczór grał w gry na komputerze.,Przepisał od Andrzeja pracę domową.,Niestety nauczyciel przyłapał ich na oszustwie.,,,,filler,filler26,sensible,filler26,
54,,Tymon przygotowywał się do matury z biologii.,Chodził na korepetycje z Krystianem.,Jego mama kupowała sukienki dla Krystiana.,,,,pronoun,filler15,nonsensible,filler15,
55,27.0,Grażyna usiadła przy komputerze.,Przesłała e-mailem Klarze podziękowania.,"Nie wiedziała, co powinna odpowiedzieć Grażynie.",13.0,11.0,1.0,null,noncentered,5,target,
56,,Mateusz od kilku dni przeraźliwie kaszlał.,Zaraził się grypą od Adriana.,Żaden z nich nie był zaszczepiony.,,,,filler,filler29,sensible,filler29,
57,31.0,Sylwia była niezwykle wzburzona.,W gniewie zepchnęła Malwinę ze schodów.,"Ona była wstrząśnięta tym, że Malwina przespała się z jej mężem.",19.0,9.0,0.0,pronoun,centered,6,target,
58,,Dominika oblała egzamin wstępny na studia.,Jej katastrofa bardzo dotknęła Wojtka.,Wojtek wlazł na łóżko Dominiki i zawinął się w prześcieradło.,,,,noun,filler9,nonsensible,filler9,
59,112.0,"Darek zatrzymał się, zobaczywszy czerwone światło.",Zobaczył Wojtka przy przejściu dla pieszych.,"On rozglądał się uważnie, wypatrując Darka.",14.0,12.0,1.0,pronoun,noncentered,19,target,
60,,Marek miał już dość nieczystej gry przeciwników.,Kopnął w nogę Ziemowita.,Największe dzieło Marka podobało się najbardziej Ziemowitowi.,,,,noun,filler7,nonsensible,filler7,
61,126.0,Witold był bardzo ambitnym biegaczem przełajowym.,Postanowił ścigać się z Mikołajem.,"Nie był dziś w formie, a mimo to udało mu się wygrać z Mikołajem.",21.0,18.0,1.0,null,centered,22,target,
62,,Paula poprosiła o pożyczkę Łucję.,"Wiedziała, na co może liczyć ze strony Łucji.",Dla niej najważniejszy był ulubiony grzebień Łucji.,,,,pronoun,filler3,nonsensible,filler3,
63,87.0,Marta poszła wczoraj do kwiaciarni.,Kupiła Natalii wielki bukiet róż.,"Była zaskoczona, że choć się nie lubią, to Marta zdobyła się na taki gest.",21.0,13.0,0.0,null,noncentered,15,target,
64,,Prosiaczek przyszedł na podwieczorek do Puchatka.,Lubił jeść z Puchatkiem miód.,"On często ziewał, gdy Puchatek wchodził na drzewo.",,,,pronoun,filler14,nonsensible,filler14,
65,,Damian wysłał na czacie swoje zdjęcie bez koszulki.,Nie potrafił zaimponować Sylwii.,Jego zaloty w ogóle na nią nie działały.,,,,filler,filler31,sensible,filler31,
66,16.0,Jan bardzo lubi rywalizować z innymi chłopcami.,Wygrał tym razem w szachy z Krzysztofem.,"On często miał problem, gdy Jan grał białymi.",12.0,7.0,0.0,pronoun,noncentered,3,target,
67,,Maja już długo starała się o potomstwo.,Urodziła dziecko Rafałowi.,Oboje byli bardzo szczęśliwi.,,,,filler,filler35,sensible,filler35,
68,125.0,Ada cały dzień czuła się nieswojo.,Wyszła z Krysią na spacer.,"Krysia zebrała się wreszcie na odwagę, by wyznać wszystko Adzie.",17.0,0.0,1.0,noun,noncentered,21,target,
69,,Paweł w młodości dużo grał w hokeja.,Uczył Paulinę jeździć na łyżwach.,Dlatego poszli na lodowisko.,,,,filler,filler39,sensible,filler39,
