,F1,F1_ORIGINAL,F2,centering,czy_ostatnie,index,l1,l2sens,realization,set,sylaby przydawka,target
0,"Wiktor uścisnął na koniec dłoń Pawła, o którym wszyscy dobrze mówili.",Wiktor uścisnął na koniec dłoń Pawła.,"On był zadowolony z transakcji, którą zawarł z Pawłem.",centered,1.0,37.0,18.0,16.0,pronoun,7,,target
1,"Kacper zabrał na wycieczkę Sebastiana, który nigdy wcześniej nie był za granicą.",Kacper zabrał Sebastiana na wycieczkę.,Sebastianowi podobała się ich wspólna wyprawa.,filler21,,,,,filler,sensible,,filler21
2,"Michał zadzwonił wcześnie rano do Karola, który bardzo często wstawał przed szóstą.",Michał zadzwonił wcześnie rano do Karola.,"On miał ważną sprawę, dlatego chciał szybko skontaktować się z Karolem.",centered,1.0,55.0,21.0,18.0,pronoun,10,,target
3,"Klara zawsze wytrącała z równowagi Jagodę, która jej po prostu nie znosiła.",Klara zawsze wytrącała Jagodę z równowagi.,Klara nigdy nie spóźniała się na korepetycje u Jagody.,filler6,,,,,noun,nonsensible,,filler6
4,"Konrad umówił się pod sklepem z Błażejem, który zawsze przychodził punktualnie.",Konrad umówił się z Błażejem pod sklepem.,"Siedział pod sklepem godzinę, jednak nie doczekał się Konrada.",noncentered,1.0,177.0,18.0,15.0,null,30,,target
5,"Katastrofa Dominiki bardzo dotknęła Wojtka, który nie umiał ukryć swojej troski o nią.",Katastrofa Dominiki bardzo dotknęła Wojtka.,Wojtek wlazł na łóżko Dominiki i zawinął się w prześcieradło.,filler9,,,,,noun,nonsensible,,filler9
6,"Witold postanowił ścigać się z Mikołajem, który od roku był niepokonany.",Witold postanowił ścigać się z Mikołajem.,"On nie był dziś w formie, a mimo to udało mu się wygrać z Witoldem.",noncentered,1.0,130.0,22.0,19.0,pronoun,22,,target
7,"Gracjan jest największym fanem The Chainsmokers, których manadżerem jest Adam Alpert.",Gracjan jest największym fanem The Chainsmokers.,Chodził na wszystkie ich koncerty.,filler33,,,,,filler,sensible,,filler33
8,"Jan wygrał tym razem w szachy z Krzysztofem, który miał ostatnio dobrą passę.",Jan wygrał tym razem w szachy z Krzysztofem.,"Krzysztof często miał problem, gdy Jan grał białymi.",noncentered,0.0,17.0,13.0,0.0,noun,3,,target
9,"Tadeusz codziennie pisał wiersze dla Marii, która chowała je wszystkie w szufladzie.",Tadeusz codziennie pisał wiersze dla Marii.,Według niego najważniejsze było śpiewanie piosenek dla Marii.,filler13,,,,,pronoun,nonsensible,,filler13
10,"Igor usiadł w ławce razem z Albertem, który był pełen zapału do pracy.",Igor usiadł w ławce razem z Albertem.,"Albert był zadowolony, że się udało, bo zawsze bardzo dobrze mu się pracowało z Igorem.",noncentered,1.0,155.0,30.0,0.0,noun,26,,target
11,"Maja urodziła dziecko Rafałowi, który zawsze chciał być ojcem.",Maja urodziła dziecko Rafałowi.,Oboje byli bardzo szczęśliwi.,filler35,,,,,filler,sensible,,filler35
12,"Tymon chodził na korepetycje z Krystianem, który był w równoległej klasie.",Tymon chodził na korepetycje z Krystianem.,Jego mama kupowała sukienki dla Krystiana.,filler15,,,,,pronoun,nonsensible,,filler15
13,"Marzena często komplementowała Zosię, która ubierała się oryginalne.",Marzena często komplementowała Zosię.,"Marzena zawsze uważała, że Zosia ma dobry gust.",centered,0.0,8.0,16.0,0.0,noun,2,,target
14,"Zuzia była najlepszą przyjaciółką Justyny, która była jej daleką kuzynką.",Zuzia była najlepszą przyjaciółką Justyny.,Wszystko robiły razem i zawsze były ze sobą zgodne.,filler28,,,,,filler,sensible,,filler28
15,"Hania zgubiła podczas wycieczki złote kolczyki Julii, która lubiła ładną biżuterię.",Hania zgubiła podczas wycieczki złote kolczyki Julii.,"Ona będzie musiała przyznać się mamie, że pożyczyła kolczyki od Julii.",centered,1.0,103.0,23.0,21.0,pronoun,18,,target
16,"Łukaszowi bardzo podoba się Natalia, którą spotkał na kursie spadochronowym.",Łukaszowi bardzo podoba się Natalia.,"Chciałby ją zaprosić na randkę, ale boi się odrzucenia.",filler27,,,,,filler,sensible,,filler27
17,"Tomek zaplanował wyjazd z Magdą, która była dziewczyną jego najlepszego przyjaciela.",Tomek zaplanował wyjazd z Magdą.,"Jakby Tomek nie zjadł pączka, to Magda nie byłaby zła.",filler17,,,,,noun,nonsensible,,filler17
18,"Olek znowu zdradził Franciszkę, z którą nie dogadywał się od dłuższego czasu.",Olek znowu zdradził Franciszkę.,Nie mogła sobie z tym poradzić.,filler38,,,,,filler,sensible,,filler38
19,"Zrozpaczona Zosia przytuliła się do Maćka, na którego zawsze mogła liczyć.",Zrozpaczona Zosia przytuliła się do Maćka.,"Zosia przeczytała ""Lalkę"", którą Maciek omawiał na lekcji.",filler20,,,,,noun,nonsensible,,filler20
20,"Aniela znalazła pracę w firmie Bartka, który zaproponował jej wolną posadę.",Aniela znalazła pracę w firmie Bartka.,Zawsze lubili razem pracować.,filler36,,,,,filler,sensible,,filler36
21,"Rafał często znęcał się nad Grzesiem, który nawet nie starał się bronić.",Rafał często znęcał się nad Grzesiem.,W końcu któregoś dnia postanowił poskarżyć się na Rafała. ,noncentered,1.0,69.0,14.0,11.0,null,12,,target
22,"Irena odziedziczyła cały spadek po Konradzie, który niespodziewanie zmarł w czasie wakacji.",Irena odziedziczyła cały spadek po Konradzie.,Stała się z dnia na dzień obrzydliwie bogata.,filler30,,,,,filler,sensible,,filler30
23,"Jurek bardzo pokłócił się z Leszkiem, który zazwyczaj unikał konfliktów.",Jurek bardzo pokłócił się z Leszkiem.,"Nie mógł zrozumieć, dlaczego nie może przekonać Jurka do swojego zdania.",noncentered,0.0,141.0,23.0,15.0,null,24,,target
24,"Dla Radka najważniejsze było bezpieczeństwo Oli, która często wracała sama do domu po zmroku.",Dla Radka najważniejsze było bezpieczeństwo Oli.,Dlatego wysłał ją na kurs samoobrony.,filler22,,,,,filler,sensible,,filler22
25,"Daria wybrała się na wyprawę górską razem z Kingą, która od dawna chciała gdzieś wyjechać.",Daria wybrała się razem z Kingą na wyprawę górską.,"Zastanawia się, czy spanie w szałasie nie będzie zbyt uciążliwe dla Kingi.",centered,1.0,144.0,23.0,21.0,null,25,11.0,target
26,"Paula wiedziała, na co może liczyć ze strony Łucji, która już nie raz dała się poznać ze złej strony.","Paula wiedziała, na co może liczyć ze strony Łucji.",Dla niej najważniejszy był ulubiony grzebień Łucji.,filler3,,,,,pronoun,nonsensible,,filler3
27,"Dawid marzył o dorównaniu Paulinie, która grała na gitarze lepiej od niego.",Dawid marzył o dorównaniu Paulinie.,"Gdy Dawid wchodził po schodach, Paulina patrzyła uważnie.",filler10,,,,,noun,nonsensible,,filler10
28,"Ala wysłała do sklepu po zakupy Kasię, na której można było zawsze polegać.",Ala wysłała Kasię do sklepu po zakupy.,"Ona nie mogła znaleźć rzeczy, o które poprosiła ją Ala.",noncentered,1.0,76.0,18.0,16.0,pronoun,13,,target
29,"Klemens gotował obiad razem z Heleną, która cały czas żartowała ze swoich z rodziców.",Klemens gotował razem z Heleną obiad.,Niestety zagapili się i przypaliła im się zupa.,filler24,,,,,filler,sensible,,filler24
30,"Grażyna przesłała e-mailem podziękowania Klarze, której pomoc była nieoceniona.",Grażyna przesłała e-mailem Klarze podziękowania.,"Ona nie wiedziała, co powinna odpowiedzieć Grażynie.",noncentered,1.0,28.0,14.0,12.0,pronoun,5,,target
31,"Wojtek przepisał pracę domową od Andrzeja, który jest pupilkiem matematyka.",Wojtek przepisał od Andrzeja pracę domową.,Niestety nauczyciel przyłapał ich na oszustwie.,filler26,,,,,filler,sensible,,filler26
32,"Olga przepisała pracę domową od Ani, która popełniła specyficzny błąd.",Olga przepisała pracę domową od Ani.,"Ona nie podejrzewała, jakie nieprzyjemności będzie miała z tego powodu Olga.",noncentered,1.0,136.0,27.0,25.0,pronoun,23,,target
33,"Paweł uczył jeździć na łyżwach Paulinę, którą już od miesiąca stara się poderwać.",Paweł uczył Paulinę jeździć na łyżwach.,Dlatego poszli na lodowisko.,filler39,,,,,filler,sensible,,filler39
34,"Bartek z wściekłością wyrzucił z pokoju Maćka, który bardzo głośno słuchał muzyki.",Bartek z wściekłością wyrzucił Maćka z pokoju.,"Maciek zawsze strasznie hałasował, gdy Bartek chciał się skoncentrować.",noncentered,0.0,53.0,19.0,0.0,noun,9,,target
35,"Prosiaczek lubił jeść miód z Puchatkiem, który mieszkał na zachód od Stumilowego Lasu.",Prosiaczek lubił jeść z Puchatkiem miód.,"On często ziewał, gdy Puchatek wchodził na drzewo.",filler14,,,,,pronoun,nonsensible,,filler14
36,"Tomek znalazł w szatni zeszyt Kuby, który uczył się do egzaminu.",Tomek znalazł w szatni zeszyt Kuby.,"Ucieszył się, bo już dawno temu miał go zwrócić Kubie.",centered,1.0,18.0,16.0,12.0,null,4,10.0,target
37,"Szczepan poszedł na imprezę z Olą, która przyniosła wino i sernik.",Szczepan poszedł na imprezę z Olą.,Według Szczepana największe szanse w maratonie ma Ola.,filler19,,,,,noun,nonsensible,,filler19
38,"Staś pomógł myć samochód Adamowi, który robił to pierwszy raz w życiu.",Staś pomógł Adamowi myć samochód.,"Mył szyby specjalnym płynem, a Adam czyścił pastą felgi.",centered,0.0,78.0,17.0,9.0,null,14,11.0,target
39,"Krzysztof postanowił zrobić remont w mieszkaniu Dominiki, która w zamian pożyczyła mu samochód.",Krzysztof postanowił zrobić remont w mieszkaniu Dominiki.,"Gdyby Krzysztof nie został strażakiem, Dominice starczyłoby na jabłka.",filler18,,,,,noun,nonsensible,,filler18
40,"Darek zobaczył przy przejściu dla pieszych Wojtka, który patrzył właśnie w inną stronę.",Darek zobaczył Wojtka przy przejściu dla pieszych.,"Zamachał energicznie, by zwrócić uwagę Wojtka.",centered,1.0,108.0,15.0,13.0,null,19,11.0,target
41,"Jan nie był w stanie wysłać czeku Tadkowi, który akurat na gwałt potrzebował pieniędzy.",Jan nie był w stanie wysłać Tadkowi czeku.,"On był tak dumny, że Tadek mógł to zrobić.",filler1,,,,,pronoun,nonsensible,,filler1
42,"Asia znalazła na strychu stary pamiętnik Ewy, która zawsze wydawała się miła.",Asia znalazła na strychu stary pamiętnik Ewy.,"Ewa, pamiętając, co kiedyś o niej napisała, nie mogła zdobyć się na rozmowę z Asią.",noncentered,1.0,65.0,28.0,0.0,noun,11,,target
43,"Lilka zaprzyjaźniła się z Marianką, która jest od niej młodsza tylko o dwa miesiące.",Lilka zaprzyjaźniła się z Marianką.,Lubiły bawić się razem lalkami.,filler37,,,,,filler,sensible,,filler37
44,"Marysia pozmywała naczynia za Sonię, która znów nie wyrabia się z pracą.",Marysia pozmywała naczynia za Sonię.,"Musi się nauczyć, żeby nie obciążać swoimi obowiązkami Marysi.",noncentered,1.0,99.0,17.0,15.0,null,17,,target
45,"Mikołaj co roku przynosił prezenty Tosi, która zawsze starała się być grzeczna.",Mikołaj co roku przynosił prezenty Tosi.,On bardzo lubił pleść Tosi warkocze.,filler11,,,,,pronoun,nonsensible,,filler11
46,"Marek kopnął w nogę Ziemowita, który był po prostu bardzo irytujący.",Marek kopnął w nogę Ziemowita.,Największe dzieło Marka podobało się najbardziej Ziemowitowi.,filler7,,,,,noun,nonsensible,,filler7
47,"Lena nie jest w stanie skontaktować się z Klarą, która nic jeszcze nie wie o wypadku.",Lena nie jest w stanie skontaktować się z Klarą.,"Ona przynajmniej od tygodnia ma zepsuty telefon, więc nie może zadzwonić do Klary.",centered,1.0,157.0,26.0,24.0,pronoun,27,,target
48,"Zosia nie potrafiła doradzić Lucynie, która od tygodnia chodziła załamana.",Zosia nie potrafiła doradzić Lucynie.,Problem ten był dla niej zbyt skomplikowany.,filler25,,,,,filler,sensible,,filler25
49,"Marcin nie lubi pracować z Hubertem, który jest jego najbliższym sąsiadem.",Marcin nie lubi pracować z Hubertem.,"On nie lubi robić wszystkiego w pośpiechu, a Hubertowi to nie przeszkadza.",centered,0.0,91.0,23.0,14.0,pronoun,16,,target
50,"Adrian zawsze liczył się ze zdaniem Gosi, która zajmowała się aranżacją wnętrz.",Adrian zawsze liczył się ze zdaniem Gosi.,"Uważał, że ona ma naprawdę fantastyczny gust.",filler34,,,,,filler,sensible,,filler34
51,"Sonia pożyczyła rower od Niny, która szykowała się do wyjścia.",Sonia pożyczyła rower od Niny.,"Miała później wyrzuty sumienia, ponieważ w drodze do pracy Sonię potrącił samochód.",noncentered,0.0,171.0,27.0,19.0,null,29,,target
52,"Staś próbował zrobić ulubiony tort Doroty, która bardzo lubiła słodycze.",Staś próbował zrobić ulubiony tort Doroty.,"Dobrze robił fikołki, a Dorota lubiła czytać kryminały.",filler12,,,,,pronoun,nonsensible,,filler12
53,"Marta kupiła wielki bukiet róż Natalii, która bardzo lubiła cięte kwiaty.",Marta kupiła Natalii wielki bukiet róż.,"Natalia była zaskoczona, że choć się nie lubią, to Marta zdobyła się na taki gest.",noncentered,0.0,89.0,24.0,0.0,noun,15,,target
54,"Kaczor Donald był ulubionym gościem Myszki Miki, która z zaciekawieniem słuchała jego opowieści.",Kaczor Donald był ulubionym gościem Myszki Miki.,Uwielbiali spędzać ze sobą czas.,filler32,,,,,filler,sensible,,filler32
55,"Werka pogłaskała po głowie Łatkę, która bardzo lubiła być pieszczona.",Werka pogłaskała Łatkę po głowie.,"Często tak robiła, gdy zostawiała Łatkę samą w domu.",centered,0.0,42.0,18.0,11.0,null,8,11.0,target
56,"Damian nie potrafił zaimponować Sylwii, która ostatnio bardzo wydoroślała.",Damian nie potrafił zaimponować Sylwii.,Jego zaloty w ogóle na nią nie działały.,filler31,,,,,filler,sensible,,filler31
57,"Ada wyszła na spacer z Krysią, która ostatnio unikała spotkań.",Ada wyszła z Krysią na spacer.,"Ada zebrała się wreszcie na odwagę, by wyznać wszystko Krysi.",centered,1.0,122.0,17.0,0.0,noun,21,,target
58,"Staś zawsze podziwiał Rafała, który był już prawie dorosły.",Staś zawsze podziwiał Rafała.,Był dla niego kimś w rodzaju starszego brata.,filler23,,,,,filler,sensible,,filler23
59,"Adrian przeczytał wiadomość od Kacpra, który ma do przekazania ważną rzecz.",Adrian przeczytał wiadomość od Kacpra.,"Adrian nie może jednak wyjść z pracy wcześniej, by spotkać się teraz z Kacprem.",centered,1.0,164.0,22.0,0.0,noun,28,,target
60,"Ula pomogła sprzątnąć dom Mariuszowi, który nie jest zbyt zaradny.",Ula pomogła sprzątnąć dom Mariuszowi.,Sam by sobie nie poradził z tym bałaganem.,filler40,,,,,filler,sensible,,filler40
61,"Basia w sekrecie powiedziała o wypadku Oli, której oczy lśniły z ciekawości.",Basia w sekrecie powiedziała Oli o wypadku.,"Basia wie, że nie dotrzymała tajemnicy, wszystko mówiąc Oli.",centered,1.0,116.0,19.0,0.0,noun,20,,target
62,"Teresa wrzuciła banknot do skrytki Marty, której była winna pieniądze.",Teresa wrzuciła do skrytki Marty banknot.,"Ona była zawsze umalowana, czego zazdrościła jej Marta.",filler5,,,,,pronoun,nonsensible,,filler5
63,"Marcin starał się uspokoić Magdalenę, która od godziny nie mogła przestać płakać.",Marcin starał się uspokoić Magdalenę.,"Dla Marcina w miarę postępów było coraz jaśniejsze, dlaczego to Magdalena.",filler8,,,,,noun,nonsensible,,filler8
64,"Kasia straciła zaufanie do Janiny, z którą już wcześniej pracowała przy zbiorach.",Kasia straciła zaufanie do Janiny.,"Gdyby nie jej torebka, to Janina miałaby więcej szczęścia.",filler2,,,,,pronoun,nonsensible,,filler2
65,"Jacek szczerze przeprosił Piotra, który cały dzień uparcie milczał.",Jacek szczerze przeprosił Piotra.,Jacek był wczoraj bardzo niemiły dla Piotra.,centered,1.0,2.0,13.0,0.0,noun,1,,target
66,"Mateusz zaraził się grypą od Adriana, z którym widział się tylko dziesięć minut.",Mateusz zaraził się grypą od Adriana.,Żaden z nich nie był zaszczepiony.,filler29,,,,,filler,sensible,,filler29
67,"Sylwia w gniewie zepchnęła ze schodów Malwinę, która nawet nie zdążyła krzyknąć.",Sylwia w gniewie zepchnęła Malwinę ze schodów.,"Ona doskonale wiedziała, dlaczego Sylwia to zrobiła.",noncentered,0.0,34.0,19.0,12.0,pronoun,6,,target
68,"Agnieszka pomagała w lekcjach Adamowi, który przez dwa miesiące chorował.",Agnieszka pomagała w lekcjach Adamowi.,"Gdyby nie Agnieszka, Adam by chodził w porwanych skarpetkach.",filler16,,,,,noun,nonsensible,,filler16
69,"Grzegorz naprawił ulubiony zegar Jana, który bardzo sobie cenił tę pamiątkę po dziadkach.",Grzegorz naprawił ulubiony zegar Jana.,Jego firanki nigdy nie miały dla Jana znaczenia.,filler4,,,,,pronoun,nonsensible,,filler4
