,Numer,Zdanie,"Sugeruje, że",Rodzaj,Typ,Czasownik,Poch/nag,Czas
0,247PXF,"""Beata dała świnkom morskim marchewkę i seler.""",Beata nie dała świnkom morskim pietruszki.,P Q,filler,,,
1,087OXK,"""Lucjusz wiedział, że jeżeli studentka kupi czerwony zeszyt, to jej kolega to zauważy.""",Lucjusz zasługuje na naganę.,C,target,wiedzieć,N,przeszły
2,117OXK,"""Hubert wiedział, że pojechanie autobusem 128 spowoduje, że dotrze na miejsce o czwartej po południu.""",Hubert zasługuje na pochwałę.,W,target,wiedzieć,P,przeszły
3,220LXF,"""Tadeusz został niesłusznie skazany za zabicie swojej żony.""",Tadeusz nie zabił swojej żony.,L,filler,,,
4,055OXZ,"""Celina myślała, że Amelia poczuła dochodzący z kuchni zapach oregano.""",Celina zasługuje na pochwałę.,Z,target,myśleć,P,przeszły
5,268NXF,"""Juliusz wziął udział w loterii.""",Juliusz wygra główną nagrodę.,N,filler,,,
6,054OXZ,"""Rupert wiedział, że Ludwice przyśniło się, że rozmawiała z siostrą o pogodzie.""",Rupert zasługuje na pochwałę.,Z,target,wiedzieć,P,przeszły
7,044OXZ,"""Bogdan myślał, że Dorota dostrzegła za oknem zaśnieżone czubki drzew.""",Bogdan zasługuje na naganę.,Z,target,myśleć,N,przeszły
8,273NXF,"""Piorun trafił w najwyższą wieżę zamku.""",w pożarze zginęło dwoje dzieci.,N,filler,,,
9,256PXF,"""Przed pójściem spać Tymek przytulił kota.""",Tymek przytulił swojego kota.,P R,filler,,,
10,103OXK,"""Albert wiedział, że wciśnięcie przycisku spowoduje, że światło w pokoju zgaśnie.""",Albert zasługuje na naganę.,W,target,wiedzieć,N,przeszły
11,020WXO,"""Damian wiedział, że stolica Andory jest najwyżej położoną stolicą w Europie.""",Damian zasługuje na naganę.,O,target,wiedzieć,N,przeszły
12,116OXK,"""Alfred myślał, że jeżeli ściszy głos, to brat go nie usłyszy.""",Alfred zasługuje na naganę.,W,target,myśleć,N,przeszły
13,259PXF,"""Kajtek przyniósł chleb ze sklepu.""",Kajtek zapłacił za chleb w sklepie.,P R,filler,,,
14,109OXK,"""Martyna wiedziała, że jeżeli Patrycja wywiesi transparent, to wiele osób go zobaczy.""",Martyna zasługuje na pochwałę.,C,target,wiedzieć,P,przeszły
15,042OXZ,"""Marcelina myślała, że na południu Polski ciśnienie powietrza wzrosło.""",Marcelina zasługuje na pochwałę.,Z,target,myśleć,P,przeszły
16,233PXF,"""Ksenia zjadła obiad i poszła do pracy.""",Ksenia zjadła obiad przed pracą.,P sekwencja,filler,,,
17,107OXK,"""Gabriela wiedziała, że zamknięcie drzwi spowoduje, że nikt nie będzie mógł wejść do środka.""",Gabriela zasługuje na pochwałę.,W,target,wiedzieć,P,przeszły
18,237PXF,"""Kot ziewnął i przeciągnął się.""","kot najpierw ziewnął, a potem się przeciągnął.",P sekwencja,filler,,,
19,266NXF,"""Niektóre słonie są duże.""",wszystkie słonie są silne.,N,filler,,,
20,204LXF,"""Nie wszyscy studenci zdali egzamin.""",niektórzy studenci nie zdali egzaminu.,L,filler,,,
21,097OXK,"""Rafał wiedział, że wezwanie od szefa sprawi, że pójdzie do jego gabinetu.""",Rafał zasługuje na pochwałę.,W,target,wiedzieć,P,przeszły
22,250PXF,"""Ulubiona nauczycielka Henia uczy plastyki i muzyki.""",ulubiona nauczycielka Henia nie uczy etyki.,P Q,filler,,,
23,253PXF,"""Kwiatkowscy weszli do domu.""",Kwiatkowscy weszli do własnego domu.,P R,filler,,,
24,081OXK,"""Anna wiedziała, że przyjście o jedenastej spowoduje, że spotka dozorcę.""",Anna zasługuje na pochwałę.,W,target,wiedzieć,P,przeszły
25,019MXO,"""Basia myślała, że grecki hymn państwowy jest najdłuższym hymnem na świecie.""",Basia zasługuje na pochwałę.,O,target,myśleć,P,przeszły
26,264NXF,"""Konrad wczoraj spadł z krzesła.""",Konrad wysłał dzisiaj dwa listy.,N,filler,,,
27,272NXF,"""Sandra usłyszała od przyjaciółki, że w ich ulubionej księgarni jest promocja.""",przyjaciółka Sandry jest wysoka.,N,filler,,,
28,106OXK,"""Selekcjoner myślał, że jeśli wpuści na boisko Kowalskiego, to mecz zakończy się remisem.""",selekcjoner zasługuje na naganę.,W,target,myśleć,N,przeszły
29,049OXZ,"""Wiktoria wiedziała, że konkurs zakończył się dwudziestego drugiego maja.""",Wiktoria zasługuje na pochwałę.,Z,target,wiedzieć,P,przeszły
30,004MXO,"""Arek myślał, że żyrafa jest najwyższym zwierzęciem lądowym.""",Arek zasługuje na naganę.,O,target,myśleć,N,przeszły
31,230PXF,"""Możliwe, że śmierć nastąpiła w wyniku nieszczęśliwego wypadku.""","nie jest pewne, czy to był wypadek.",P skalarne,filler,,,
32,067PXZ,"""Estera myślała, że Aneta usłyszała w radiu swoją ulubioną piosenkę.""",Estera zasługuje na naganę.,Z,target,myśleć,N,przeszły
33,083OXK,"""Zygmunt wiedział, że jeśli Filip otworzy drzwi, to będzie go widać z korytarza.""",Zygmunt zasługuje na pochwałę.,C,target,wiedzieć,P,przeszły
34,113OXK,"""Muzyk wiedział, że wydanie singla spowoduje, że nowy utwór będzie często grany w radiu.""",muzyk zasługuje na naganę.,W,target,wiedzieć,N,przeszły
35,214LXF,"""Trener dowiedział się, że jeden z zawodników stosował doping.""",jeden z zawodników stosował doping.,L,filler,,,
36,082OXK,"""Eliza myślała, że jeżeli Julia zapali światło, to domownicy to zauważą.""",Eliza zasługuje na pochwałę.,C,target,myśleć,P,przeszły
37,206LXF,"""Irena domyśliła się, że jej córka przyjechała pociągiem.""",córka Ireny przyjechała pociągiem.,L,filler,,,
38,047OXZ,"""Pola wiedziała, że Małgorzata urodziła się dwudziestego września 1992 roku.""",Pola zasługuje na naganę.,Z,target,wiedzieć,N,przeszły
39,242PXF,"""Krzysztof niechcący wpadł na stojący na chodniku zielony rower.""",to nie był rower Krzysztofa.,P Q,filler,,,
40,001WXO,"""Jerzy wiedział, że Ziemia jest okrągła.""",Jerzy zasługuje na pochwałę.,O,target,wiedzieć,P,przeszły
41,017MXO,"""Ola myślała, że w Rosji jest jedenaście stref czasowych.""",Ola zasługuje na naganę.,O,target,myśleć,N,przeszły
42,007WXO,"""Kinga wiedziała, że kora większości gatunków brzozy jest biała.""",Kinga zasługuje na naganę.,O,target,wiedzieć,N,przeszły
43,210LXF,"""Jarek nie zauważył, że jego pies wybiegł z domu.""",pies Jarka wybiegł z domu.,L,filler,,,
44,043OXZ,"""Zofia wiedziała, że drugiego sierpnia Słońce zajdzie o dwudziestej dwadzieścia pięć.""",Zofia zasługuje na naganę.,Z,target,wiedzieć,N,przeszły
45,011MXO,"""Wioletta myślała, że w styczniu Ziemia znajduje się najbliżej Słońca.""",Wioletta zasługuje na pochwałę.,O,target,myśleć,P,przeszły
46,238PXF,"""Ireneusz miał wypadek samochodowy i przeszedł operację.""",wypadek miał miejsce przed operacją.,P sekwencja,filler,,,
47,229PXF,"""Troje studentów nie zdało egzaminu.""",wszyscy pozostali studenci zdali.,P skalarne,filler,,,
48,270NXF,"""Natalia chce polecieć do Finlandii.""",brat Natalii jest poważnie chory.,N,filler,,,
49,104OXK,"""Iga myślała, że jeśli Monika poleci ten film, to jej kolega go obejrzy.""",Iga zasługuje na naganę.,C,target,myśleć,N,przeszły
50,255PXF,"""Wieczorem Daria ułożyła dziecko do snu.""",Daria ułożyła do snu swoje dziecko.,P R,filler,,,
51,084OXK,"""Maciek myślał, że jeżeli odsłoni żaluzje, to jego siostra spojrzy za okno.""",Maciek zasługuje na pochwałę.,W,target,myśleć,P,przeszły
52,251PXF,"""Ewa złamała palec u nogi.""",Ewa złamała swój palec.,P R,filler,,,
53,208LXF,"""Żadne zwierzę nie jest tak szybkie jak Struś Pędziwiatr.""",wszystkie psy są wolniejsze niż Struś Pędziwiatr.,L,filler,,,
54,254PXF,"""Ojciec przyjechał na spotkanie samochodem.""",ojciec przyjechał własnym samochodem.,P R,filler,,,
55,013MXO,"""Aurelia myślała, że pingwiny potrafią nurkować na głębokość ponad 250 metrów.""",Aurelia zasługuje na naganę.,O,target,myśleć,N,przeszły
56,086OXK,"""Wiktoria myślała, że jeśli Antoni ugotuje dla żony danie z pomidorami, to ona poczuje ich smak.""",Wiktoria zasługuje na naganę.,C,target,myśleć,N,przeszły
57,216LXF,"""Żona burmistrza wywołała skandal.""",burmistrz ma żonę.,L,filler,,,
58,058OXZ,"""Franciszka wiedziała, że temperatura w Łodzi utrzymała się na podobnym poziomie przez cały tydzień.""",Franciszka zasługuje na pochwałę.,Z,target,wiedzieć,P,przeszły
59,225PXF,"""Dziecko zjadło kilka kawałków ciasta.""",dziecko nie zjadło wszystkich kawałków ciasta.,P skalarne,filler,,,
60,016WXO,"""Justyna wiedziała, że 90% ludzi mieszka na półkuli północnej.""",Justyna zasługuje na naganę.,O,target,wiedzieć,N,przeszły
61,236PXF,"""Przyjaciele pójdą do kina i na karaoke.""",przyjaciele najpierw pójdą do kina.,P sekwencja,filler,,,
62,209LXF,"""Piosenkarka jeszcze nie wie, że jej nowy utwór zyskuje dużą popularność za granicą.""",nowy utwór piosenkarki zyskuje dużą popularność za granicą.,L,filler,,,
63,245PXF,"""W Warszawie i w Krakowie zanotowano rekordowo niskie temperatury.""",w Poznaniu temperatura nie była rekordowo niska.,P Q,filler,,,
64,006MXO,"""Staszek myślał, że pierwiastek z szesnastu wynosi cztery.""",Staszek zasługuje na pochwałę.,O,target,myśleć,P,przeszły
65,260PXF,"""Olek położył się spać.""",Olek położył się do łóżka.,P R,filler,,,
66,002MXO,"""Róża myślała, że woda to tlenek wodoru.""",Róża zasługuje na pochwałę.,O,target,myśleć,P,przeszły
67,052OXZ,"""Kaja wiedziała, że pierwszego stycznia w Tatrach spadł śnieg.""",Kaja zasługuje na naganę.,Z,target,wiedzieć,N,przeszły
68,155NXK,"""Jacek myślał, że niezadbanie o stan urządzeń na placu zabaw zagrozi bezpieczeństwu dzieci.""",Jacek zasługuje na naganę.,W,target,myśleć,N,przeszły
69,218LXF,"""Norbert wyzdrowiał po kilkutygodniowym pobycie w szpitalu.""",Norbert był chory.,L,filler,,,
70,279NXF,"""Długotrwałe susze spowodowały śmierć wielu zwierząt.""",Oliwia straciła dach nad głową.,N,filler,,,
71,222PXF,"""Andżelika ma dwoje dzieci.""",Andżelika nie ma więcej niż dwoje dzieci.,P skalarne,filler,,,
72,105OXK,"""Ignacy wiedział, że wyjście Hanny na łyżwy sprawi, że jej bracia zostaną sami w domu.""",Ignacy zasługuje na naganę.,C,target,wiedzieć,N,przeszły
73,277NXF,"""Odkąd zmienił się właściciel firmy, zyski znacznie wzrosły.""",nowy właściciel przeżył dwa groźne wypadki samochodowe.,N,filler,,,
74,275NXF,"""Wszyscy pasażerowie samolotu przeżyli katastrofę.""",niektórzy pasażerowie są w ciężkim stanie.,N,filler,,,
75,274NXF,"""Wanda wróciła do zdrowia po grypie.""",Wanda nie ma samochodu.,N,filler,,,
76,015MXO,"""Ilona myślała, że oko strusia jest większe od jego mózgu.""",Ilona zasługuje na pochwałę.,O,target,myśleć,P,przeszły
77,207LXF,"""Wszyscy czarodzieje są inteligentni.""",Harry Potter jest inteligentny.,L,filler,,,
78,089OXK,"""Wojciech wiedział, że założenie granatowego swetra sprawi, że on i jego brat będą podobnie ubrani.""",Wojciech zasługuje na pochwałę.,W,target,wiedzieć,P,przeszły
79,267NXF,"""Pawła dotkliwie pokąsały komary.""",wróg Pawła planuje go zabić.,N,filler,,,
80,271NXF,"""Polska wygrała mistrzostwa świata w piłce ręcznej.""",na Mazowszu zboże wyjątkowo obrodziło.,N,filler,,,
81,023MXO,"""Sebastian myślał, że Polska co roku uzyskuje coraz wyższe miejsce w światowym rankingu szczęśliwości.""",Sebastian zasługuje na naganę.,O,target,myśleć,N,przeszły
82,098OXK,"""Franek myślał, że pociągnięcie dźwigni przez Łukasza spowoduje, że urządzenie zatrzyma się.""",Franek zasługuje na pochwałę.,C,target,myśleć,P,przeszły
83,261NXF,"""Karol dostał dobrą ocenę z matematyki.""",Wisła wystąpiła z brzegów.,N,filler,,,
84,095OXK,"""Tina wiedziała, że prośba Sylwii spowoduje, że jej syn położy książkę na stole.""",Tina zasługuje na naganę.,C,target,wiedzieć,N,przeszły
85,014WXO,"""Gilbert wiedział, że spośród wszystkich gatunków ptaków tylko kolibry umieją latać do tyłu.""",Gilbert zasługuje na pochwałę.,O,target,wiedzieć,P,przeszły
86,056OXZ,"""Michał wiedział, że Piotr dostał SMS dwie minuty temu.""",Michał zasługuje na naganę.,Z,target,wiedzieć,N,przeszły
87,211LXF,"""Robert jest kawalerem.""",Robert jest nieżonatym mężczyzną.,L,filler,,,
88,085OXK,"""Alicja wiedziała, że włączenie radia sprawi, że jej siostra usłyszy audycję.""",Alicja zasługuje na naganę.,W,target,wiedzieć,N,przeszły
89,234PXF,"""Tenisistka wzięła udział w turnieju w Wiedniu i we Lwowie.""",turniej w Wiedniu odbył się wcześniej niż ten we Lwowie.,P sekwencja,filler,,,
90,269NXF,"""Kasia widzi Księżyc w pełni.""",ludzkość czeka zagłada.,N,filler,,,
91,226PXF,"""Nowożeńcy pojadą w góry lub nad morze.""",nowożeńcy nie pojadą w oba te miejsca.,P skalarne,filler,,,
92,091OXK,"""Paulina wiedziała, że jeżeli Mikołaj otworzy pudełko z kremem, to jego współlokator poczuje zapach ciastek.""",Paulina zasługuje na pochwałę.,C,target,wiedzieć,P,przeszły
93,227PXF,"""Krysia myśli, że jej brat późno wróci.""","Krysia nie wie, czy jej brat późno wróci.",P skalarne,filler,,,
94,224PXF,"""Większość psów ma cztery nogi.""",nie wszystkie psy mają cztery nogi.,P skalarne,filler,,,
95,213LXF,"""Józef wie, że jego matka studiowała psychologię.""",matka Józefa studiowała psychologię.,L,filler,,,
96,003WXO,"""Agnieszka wiedziała, że siedemnaście jest liczbą pierwszą.""",Agnieszka zasługuje na naganę.,O,target,wiedzieć,N,przeszły
97,241PXF,"""Przychodnia jest otwarta w dni powszednie od ósmej rano.""",przychodnia jest zamknięta w niedziele.,P Q,filler,,,
98,005WXO,"""Teresa wiedziała, że łoś euroazjatycki występuje w lasach Eurazji i Ameryki Północnej.""",Teresa zasługuje na pochwałę.,O,target,wiedzieć,P,przeszły
99,051OXZ,"""Jan myślał, że w środę sklep był otwarty do osiemnastej.""",Jan zasługuje na pochwałę.,Z,target,myśleć,P,przeszły
100,092OXK,"""Jędrzej myślał, że jeśli włączy czajnik, to woda zacznie się gotować.""",Jędrzej zasługuje na pochwałę.,W,target,myśleć,P,przeszły
101,246PXF,"""Malarka na swoim najnowszym obrazie użyła żółtej, czerwonej i czarnej farby.""",malarka nie użyła niebieskiej farby.,P Q,filler,,,
102,099OXK,"""Ida wiedziała, że jeśli Kamil kupi ryż, to jego rodzina zje risotto na obiad.""",Ida zasługuje na pochwałę.,C,target,wiedzieć,P,przeszły
103,262NXF,"""Feliks znalazł nową pracę.""",Feliks urodził się w maju.,N,filler,,,
104,221PXF,"""Niektóre dzieci są nieposłuszne.""",nie wszystkie dzieci są nieposłuszne.,P skalarne,filler,,,
105,114OXK,"""Luiza myślała, że jeśli znany ekspert wyda opinię, to wielu ludzi mu uwierzy.""",Luiza zasługuje na naganę.,C,target,myśleć,N,przeszły
106,053OXZ,"""Joachim myślał, że pociąg do Berlina odjechał o ósmej piętnaście.""",Joachim zasługuje na naganę.,Z,target,myśleć,N,przeszły
107,258PXF,"""Byliśmy we wtorek w kinie.""",obejrzeliśmy w kinie film.,P R,filler,,,
108,202LXF,"""Matylda wiedziała, że książka została zniszczona.""",książka została zniszczona.,L,filler,,,
109,212LXF,"""Sonia została słusznie oskarżona o kradzież naszyjnika.""",Sonia ukradła naszyjnik.,L,filler,,,
110,010WXO,"""Leszek wiedział, że liczba atomowa cynku wynosi trzydzieści.""",Leszek zasługuje na pochwałę.,O,target,wiedzieć,P,przeszły
111,240PXF,"""Zagrzmiało i spadł ulewny deszcz.""",grzmot poprzedził ulewę.,P sekwencja,filler,,,
112,119OXK,"""Turysta wiedział, że wybranie przez Janinę żółtego szlaku sprawi, że ona i jej córka będą szły przez dwie i pół godziny.""",turysta zasługuje na pochwałę.,C,target,wiedzieć,P,przeszły
113,012WXO,"""Oskar wiedział, że u kotów gen odpowiadający za ubarwienie futra znajduje się na chromosomie X.""",Oskar zasługuje na naganę.,O,target,wiedzieć,N,przeszły
114,045OXZ,"""Bożena wiedziała, że w tym roku zwycięskim numerem na loterii był numer 281.""",Bożena zasługuje na pochwałę.,Z,target,wiedzieć,P,przeszły
115,223PXF,"""Niektórzy mężczyźni mają wąsy.""",nie wszyscy mężczyźni mają wąsy.,P skalarne,filler,,,
116,205LXF,"""Mateusz dostał prezent od swojej siostry.""",Mateusz ma siostrę.,L,filler,,,
117,057OXZ,"""Adam myślał, że książka, upadając, otworzyła się na sto dwudziestej czwartej stronie.""",Adam zasługuje na naganę.,Z,target,myśleć,N,przeszły
118,252PXF,"""Tomasz wróci do domu w środę.""",Tomasz wróci w najbliższą środę.,P R,filler,,,
119,090OXK,"""Malwina myślała, że jeśli Daniel spojrzy na zegarek, to jego przyjaciel zrobi to samo.""",Malwina zasługuje na pochwałę.,C,target,myśleć,P,przeszły
120,219LXF,"""Danuta jest weganką.""",Danuta nie spożywa produktów pochodzenia zwierzęcego.,L,filler,,,
121,228PXF,"""Iza podejrzewa, że jej mąż ją zdradza.""","Iza nie wie, czy jej mąż ją zdradza.",P skalarne,filler,,,
122,148NXK,"""Kierownik wiedział, że jeśli dyrektor zwolni Kamilę, to zabraknie jej pieniędzy na utrzymanie.""",kierownik zasługuje na naganę.,C,target,wiedzieć,N,przeszły
123,278NXF,"""Jedna z myszy laboratoryjnych poważnie zachorowała.""",w Zakopanem zanotowano rekordowe opady śniegu.,N,filler,,,
124,046OXZ,"""Dawid myślał, że Szymon obudził się o siódmej dwadzieścia.""",Dawid zasługuje na pochwałę.,Z,target,myśleć,P,przeszły
125,215LXF,"""Wszyscy rycerze już nie żyją.""","jeśli ktoś żyje, to nie jest rycerzem.",L,filler,,,
126,257PXF,"""Narzeczeni wezmą ślub w grudniu.""",ślub odbędzie się w grudniu bieżącego roku.,P R,filler,,,
127,244PXF,"""W poniedziałki i środy Natasza chodzi na lekcje węgierskiego.""",Natasza nie chodzi na lekcje węgierskiego we wtorki.,P Q,filler,,,
128,048OXZ,"""Weronika myślała, że tramwaj przyjechał o dziewiątej czterdzieści jeden.""",Weronika zasługuje na naganę.,Z,target,myśleć,N,przeszły
129,239PXF,"""Zbyszek rozwiódł się i wyjechał z miasta.""",rozwód Zbyszka poprzedził jego wyjazd.,P sekwencja,filler,,,
130,093OXK,"""Witold wiedział, że jeżeli poda matce lustro, to ona zobaczy swoje odbicie.""",Witold zasługuje na naganę.,W,target,wiedzieć,N,przeszły
131,263NXF,"""Większość ludzi umie pisać.""",żaden człowiek nie umie czytać.,N,filler,,,
132,139PXK,"""Pielęgniarka myślała, że zastosowanie się przez Laurę do zaleceń lekarza spowoduje, że jej dziecko urodzi się zdrowe.""",pielęgniarka zasługuje na naganę.,C,target,myśleć,N,przeszły
133,201LXF,"""Kazik zrozumiał, w którym miejscu popełnił błąd.""",Kazik popełnił błąd.,L,filler,,,
134,203LXF,"""Lekarz zauważył, że pacjent ma szmery w sercu.""",pacjent ma szmery w sercu.,L,filler,,,
135,235PXF,"""Wiewiórka wspięła się na drzewo i zjadła orzech.”",wiewiórka zjadła orzech po wejściu na drzewo.,P sekwencja,filler,,,
136,101OXK,"""Stefan myślał, że wypożyczenie książki spowoduje, że jego kolega Cezary zobaczy jej okładkę.""",Stefan zasługuje na pochwałę.,W,target,myśleć,P,przeszły
137,115OXK,"""Kacper wiedział, że podgłośnienie muzyki przez Marcina sprawi, że usłyszy ją cała jego rodzina.""",Kacper zasługuje na naganę.,C,target,wiedzieć,N,przeszły
138,217LXF,"""Ojciec Łucji zginął w wypadku samochodowym.""",ojciec Łucji nie żyje.,L,filler,,,
139,265NXF,"""Adrianna dowiedziała się, kto będzie jej rywalem w konkursie.""",w Krakowie spadł ulewny deszcz.,N,filler,,,
140,118OXK,"""Ula myślała, że jeśli Leon obejrzy z Joanną ten film, to jej nastój diametralnie się zmieni.""",Ula zasługuje na pochwałę.,C,target,myśleć,P,przeszły
141,094OXK,"""Nina myślała, że zrobienie przez Renatę kolejnego zdjęcia sprawi, że będzie miała w galerii dwieście trzydzieści fotografii.""",Nina zasługuje na naganę.,C,target,myśleć,N,przeszły
142,135PXK,"""Dominik wiedział, że napisanie artykułu o zagrożonych gatunkach pomoże je uratować.""",Dominik zasługuje na naganę.,W,target,wiedzieć,N,przeszły
143,243PXF,"""Grzegorz założył niebieską koszulę, niebieskie buty, a nawet niebieski kapelusz.""",spodnie Grzegorza nie są niebieskie.,P Q,filler,,,
144,060OXZ,"""Ernest wiedział, że Aleks wylosował kartkę z numerem pięć.""",Ernest zasługuje na naganę.,Z,target,wiedzieć,N,przeszły
145,111OXK,"""Iwona myślała, że jeśli nagra film, to dwie osoby go obejrzą.""",Iwona zasługuje na pochwałę.,W,target,myśleć,P,przeszły
146,041OXZ,"""Władek wiedział, że temperatura w Zielonej Górze wyniosła dziś siedemnaście stopni.""",Władek zasługuje na pochwałę.,Z,target,wiedzieć,P,przeszły
147,276NXF,"""Adrian wie, że powinien odejść z pracy.""",szefowa Adriana jest zaangażowana w działalność przestępczą.,N,filler,,,
148,059OXZ,"""Marta myślała, że kamyk wpadł do wody z pluskiem.""",Marta zasługuje na pochwałę.,Z,target,myśleć,P,przeszły
149,018WXO,"""Sara wiedziała, że w Kanadzie znajduje się więcej jezior niż w którymkolwiek innym kraju na świecie.""",Sara zasługuje na pochwałę.,O,target,wiedzieć,P,przeszły
150,108OXK,"""Igor myślał, że jeśli Klaudia napisze wiadomość do męża, to on ją przeczyta.""",Igor zasługuje na pochwałę.,C,target,myśleć,P,przeszły
151,280NXF,"""Większość lekarzy jest artystami.""",większość artystów jest lekarzami.,N,filler,,,
152,248PXF,"""Węgierskie spółgłoski są łatwe w wymowie.""",wymowa węgierskich samogłosek nie jest łatwa.,P Q,filler,,,
153,009MXO,"""Jola myślała, że kanczyl to najmniejszy ssak kopytny na świecie.""",Jola zasługuje na naganę.,O,target,myśleć,N,przeszły
154,232PXF,"""Marek poszedł do sklepu i kupił bułki.""","Marek najpierw poszedł do sklepu, a następnie kupił bułki.",P sekwencja,filler,,,
155,231PXF,"""Olga wyszła za mąż i urodziła dziecko.""",ślub Olgi poprzedził narodziny dziecka.,P sekwencja,filler,,,
156,123PXK,"""Agata myślała, że jeśli zorganizuje przyjęcie urodzinowe, to dostanie dużo prezentów.""",Agata zasługuje na pochwałę.,W,target,myśleć,P,przeszły
157,088OXK,"""Emilia myślała, że jeśli wyjdzie na podwórko, to spotka sąsiada.""",Emilia zasługuje na naganę.,W,target,myśleć,N,przeszły
158,249PXF,"""W marcu i w kwietniu wciąż będzie zimno.""",w maju nie będzie już zimno.,P Q,filler,,,
159,096OXK,"""Marzena myślała, że kiedy zapyta jak Grzegorzowi minął dzień, on opowie co robił w pracy.""",Marzena zasługuje na naganę.,W,target,myśleć,N,przeszły
