,F1,F2,centering,czy_ostatnie,index,l1,l2sens,realization,set,target
0,Staś zawsze podziwiał Rafała.,Był dla niego kimś w rodzaju starszego brata.,filler23,,,,,filler,sensible,filler23
1,Kasia straciła zaufanie do Janiny.,"Gdyby nie jej torebka, to Janina miałaby więcej szczęścia.",filler2,,,,,pronoun,nonsensible,filler2
2,Mateusz zaraził się grypą od Adriana.,Żaden z nich nie był zaszczepiony.,filler29,,,,,filler,sensible,filler29
3,Szczepan poszedł na imprezę z Olą.,Według Szczepana najlepszą jajecznicę robiła Ola.,filler19,,,,,noun,nonsensible,filler19
4,Lilka zaprzyjaźniła się z Marianką.,Lubiły bawić się razem lalkami.,filler37,,,,,filler,sensible,filler37
5,Agnieszka pomagała w lekcjach Adamowi.,"Gdyby nie Agnieszka, Adam by chodził w porwanych skarpetkach.",filler16,,,,,noun,nonsensible,filler16
6,Kacper zabrał Sebastiana na wycieczkę.,Sebastianowi podobała się ich wspólna wyprawa.,filler21,,,,,filler,sensible,filler21
7,Olga przepisałą pracę domową od Ani.,"Olga nie poderzewała, jakie nieprzyjemności będzie miała z tego powodu Ania.",centered,1.0,134.0,27.0,0.0,noun,23,target
8,Tadeusz codziennie pisał wiersze dla Marii.,Według niego najważniejsze było śpiewanie piosenek dla Marii.,filler13,,,,,pronoun,nonsensible,filler13
9,Witold postanowił ścigać się z Mikołajem.,"Nie był dziś w formie, a mimo to udało mu się wygrać z Witoldem.",noncentered,1.0,129.0,21.0,19.0,null,22,target
10,Marek kopnął w nogę Ziemowita.,Największe dzieło Marka podobało się najbardziej Ziemowitowi.,filler7,,,,,noun,nonsensible,filler7
11,Asia znalazła na strychu stary pamiętnik Ewy.,"Ona po tym, czego się dowiedziała, nie mogła długo zdobyć się na rozmowę z Ewą.",centered,1.0,61.0,22.0,14.0,pronoun,11,target
12,Paweł uczył Paulinę jeździć na łyżwach.,Dlatego poszli na lodowisko.,filler39,,,,,filler,sensible,filler39
13,Grzegorz naprawił ulubiony zegar Jana.,Jego firanki nigdy nie miały dla Jana znaczenia.,filler4,,,,,pronoun,nonsensible,filler4
14,Marzena często komplementowała Zosię.,"Zawsze uważała, że Zosia ma dobry gust.",centered,0.0,6.0,13.0,7.0,null,2,target
15,Klemens gotował razem z Heleną obiad.,Niestety zagapili się i przypaliła im się zupa.,filler24,,,,,filler,sensible,filler24
16,Wiktor uścisnął na koniec dłoń Pawła.,"Paweł zastanawiał się, czy to dobrze, że sprzedał Wiktorowi motocykl.",noncentered,0.0,41.0,21.0,0.0,noun,7,target
17,Ula pomogła sprzątnąć dom Mariuszowi.,Sam by sobie nie poradził z tym bałaganem.,filler40,,,,,filler,sensible,filler40
18,Basia w sekrecie powiedziała Oli o wypadku.,"Ona wie, że nie dotrzyma tajemnicy, mimo że obiecała Basi, że nic nikomu nie powie.",noncentered,0.0,118.0,23.0,18.0,pronoun,20,target
19,Kaczor Donald był ulubionym gościem Myszki Miki.,Uwielbiali spędzać ze sobą czas.,filler32,,,,,filler,sensible,filler32
20,Marysia pozmywała naczynia za Sonię.,"Ona musi się nauczyć, żeby nie robić wszystkiego za Sonię.",centered,1.0,97.0,19.0,17.0,pronoun,17,target
21,Wojtek przepisał od Andrzeja pracę domową.,Niestety nauczyciel przyłapał ich na oszustwie.,filler26,,,,,filler,sensible,filler26
22,Werka pogłaskała Łatkę po głowie.,"Często tak robiła, gdy zostawiała Łatkę samą w domu.",centered,0.0,42.0,18.0,11.0,null,8,target
23,Tymon chodził na korepetycje z Krystianem.,Jego mama robiła pyszne obiady dla Krystiana.,filler15,,,,,pronoun,nonsensible,filler15
24,Igor usiadł w ławce razem z Albertem.,"Był zadowolony, że się udało, bo zawsze bardzo dobrze mu się pracowało z Igorem.",noncentered,1.0,153.0,28.0,25.0,null,26,target
25,Aniela znalazła pracę w firmie Bartka.,Zawsze lubili razem pracować.,filler36,,,,,filler,sensible,filler36
26,Jacek szczerze przeprosił Piotra.,On był wyraźnie urażony wypowiedzią Jacka.,noncentered,1.0,4.0,15.0,5.0,pronoun,1,target
27,Olek znowu zdradził Franciszkę.,Nie mogła sobie z tym poradzić.,filler38,,,,,filler,sensible,filler38
28,Grażyna przesłała e-mailem Klarze podziękowania.,"Cieszyła się, że udało się jej szczerze porozmawiać z Klarą.",centered,1.0,24.0,19.0,17.0,null,5,target
29,Mikołaj co roku przynosił prezenty Tosi.,On bardzo lubił pleść Tosi warkocze.,filler11,,,,,pronoun,nonsensible,filler11
30,Hania zgubiła podczas wycieczki złote kolczyki Julii.,"Hania będzie musiała przyznać się mamie, że pożyczyła kolczyki od Julii.",centered,1.0,104.0,23.0,0.0,noun,18,target
31,Dla Radka najważniejsze było bezpieczeństwo Oli.,Dlatego wysłał ją na kurs samoobrony.,filler22,,,,,filler,sensible,filler22
32,Sonia pożyczyła rower od Niny.,"Ona miała później wyrzuty sumienia, ponieważ przez to Nina spóźniła się do pracy.",centered,0.0,169.0,21.0,17.0,pronoun,29,target
33,Zrozpaczona Zosia przytuliła się do Maćka.,Zosia zawsze miała dobry humor przy Maćku.,filler20,,,,,noun,nonsensible,filler20
34,Marcin nie lubi pracować z Hubertem.,"Nie lubi robić wszystkiego w pośpiechu, a Hubertowi to nie przeszkadza.",centered,0.0,90.0,22.0,13.0,null,16,target
35,"Paula wiedziała, na co może liczyć ze strony Łucji.",Dla niej najważniejszy był ulubiony grzebień Łucji.,filler3,,,,,pronoun,nonsensible,filler3
36,Ala wysłała Kasię do sklepu po zakupy.,"Kasia nie mogła znaleźć rzeczy, o które poprosiła ją Ala.",noncentered,1.0,77.0,18.0,0.0,noun,13,target
37,Irena odziedziczyła cały spadek po Konradzie.,Stała się z dnia na dzień obrzydliwie bogata.,filler30,,,,,filler,sensible,filler30
38,Jan wygrał tym razem w szachy z Krzysztofem.,"On często miał problem, gdy Jan grał białymi.",noncentered,0.0,16.0,12.0,7.0,pronoun,3,target
39,Klara zawsze wytrącała Jagodę z równowagi.,Klara nigdy nie spóźniała się na korepetycje u Jagody.,filler6,,,,,noun,nonsensible,filler6
40,Jurek bardzo pokłócił się z Leszkiem.,"On nie mógł zrozumieć, dlaczego nie może przekonać Leszka do swojego zdania.",centered,0.0,139.0,24.0,13.0,pronoun,24,target
41,Damian nie potrafił zaimponować Sylwii.,Jego zaloty w ogóle na nią nie działały.,filler31,,,,,filler,sensible,filler31
42,Tomek znalazł w szatni zeszyt Kuby.,Nie mógł go znaleźć od tygodnia i teraz był wdzięczny Tomkowi.,noncentered,1.0,21.0,17.0,15.0,null,4,target
43,Staś próbował zrobić ulubiony tort Doroty.,"Najlepiej wychodziły mu hamburgery, których Dorota nie lubiła.",filler12,,,,,pronoun,nonsensible,filler12
44,Konrad umówił się z Błażejem pod sklepem.,"Błażej siedział pod sklepem godzinę, jednak nie doczekał się Konrada.",noncentered,1.0,179.0,20.0,0.0,noun,30,target
45,Jan nie był w stanie wysłać Tadkowi czeku.,"On był tak dumny, że Tadek mógł to zrobić.",filler1,,,,,pronoun,nonsensible,filler1
46,Katastrofa Dominiki bardzo dotknęła Wojtka.,Wojtek wlazł na łóżko Dominiki i zawinął się w prześcieradło.,filler9,,,,,noun,nonsensible,filler9
47,Lena nie jest w stanie skontaktować się z Klarą.,"Ona przynajmniej od tygodnia ma zepsuty telefon, więc nie może zadzwonić do Klary.",centered,1.0,157.0,26.0,24.0,pronoun,27,target
48,Marcin starał się uspokoić Magdalenę.,"Dla Marcina w miarę postępów było coraz jaśniejsze, dlaczego to Magdalena.",filler8,,,,,noun,nonsensible,filler8
49,Bartek z wściekłością wyrzucił Maćka z pokoju.,"Zawsze strasznie hałasował, gdy Bartek chciał się skoncentrować.",noncentered,0.0,51.0,17.0,9.0,null,9,target
50,Prosiaczek był najlepszym przyjacielem Puchatka.,On lubił podjadać miodek Puchatka.,filler14,,,,,pronoun,nonsensible,filler14
51,Ada wyszła z Krysią na spacer.,"Ada zebrała się wreszcie na odwagę, by wyznać wszystko Krysi.",centered,1.0,122.0,17.0,0.0,noun,21,target
52,Zosia nie potrafiła doradzić Lucynie.,Problem ten był dla niej zbyt skomplikowany.,filler25,,,,,filler,sensible,filler25
53,Michał zadzwonił wcześnie rano do Karola.,"Karol miał ważną sprawę, dlatego Michał oddzwonił, gdy tylko wstał.",noncentered,0.0,59.0,19.0,0.0,noun,10,target
54,Adrian zawsze liczył się ze zdaniem Gosi.,"Uważał, że ona ma naprawdę fantastyczny gust.",filler34,,,,,filler,sensible,filler34
55,Darek zobaczył Wojtka przy przejściu dla pieszych.,"Wojtek rozglądał się uważnie, wypatrując Darka.",noncentered,1.0,113.0,15.0,0.0,noun,19,target
56,Zuzia była najlepszą przyjaciółką Justyny.,Wszystko robiły razem i zawsze były ze sobą zgodne.,filler28,,,,,filler,sensible,filler28
57,Dawid marzył o dorównaniu Paulinie.,"Gdy Dawid wchodził po schodach, Paulina patrzyła uważnie.",filler10,,,,,noun,nonsensible,filler10
58,Marta kupiła Natalii wielki bukiet róż.,"Ona była zaskoczona, że choć się nie lubią, to Marta zdobyła się na taki gest.",noncentered,0.0,88.0,23.0,15.0,pronoun,15,target
59,Maja urodziła dziecko Rafałowi.,Oboje byli bardzo szczęśliwi.,filler35,,,,,filler,sensible,filler35
60,Daria wybrała się razem z Kingą na wyprawę górską.,"Daria zastanawia się, czy spanie w szałasie nie będzie zbyt uciążliwe dla Kingi.",centered,1.0,146.0,25.0,23.0,noun,25,target
61,Teresa wrzuciła do skrytki Marty banknot.,"Ona była zawsze umalowana, czego zazdrościła jej Marta.",filler5,,,,,pronoun,nonsensible,filler5
62,Staś pomógł Adamowi myć samochód.,"Staś mył szyby specjalnym płynem, a Adam czyścił pastą felgi.",centered,0.0,80.0,18.0,0.0,noun,14,target
63,Gracjan jest największym fanem The Chainsmokers.,Chodził na wszystkie ich koncerty.,filler33,,,,,filler,sensible,filler33
64,Rafał często znęcał się nad Grzesiem.,On w końcu któregoś dnia postanowił poskarżyć się na Rafała.,noncentered,1.0,70.0,15.0,12.0,pronoun,12,target
65,Tomek zaplanował wyjazd z Magdą.,"Jakby Tomek nie zjadł pączka, to Magda nie byłaby zła.",filler17,,,,,noun,nonsensible,filler17
66,Sylwia w gniewie zepchnęła Malwinę ze schodów.,"Była wstrząśnięta tym, że Malwina przespała się z jej mężem.",centered,0.0,30.0,17.0,7.0,null,6,target
67,Łukaszowi bardzo podoba się Natalia.,"Chciałby ją zaprosić na randkę, ale boi się odrzucenia.",filler27,,,,,filler,sensible,filler27
68,Adrian przeczytał wiadomość od Kacpra.,"Nie może jednak wyjść z pracy wcześniej, by spotkać się teraz z Adrianem.",noncentered,1.0,165.0,20.0,18.0,null,28,target
69,Krzysztof postanowił zrobić remont w mieszkaniu Dominiki.,"Gdyby nie Krzysztof, to Dominika poszłaby spać.",filler18,,,,,noun,nonsensible,filler18
