,F1,F2,centering,czy_ostatnie,index,l1,l2sens,realization,set,target
0,Łukaszowi bardzo podoba się Natalia.,"Chciałby ją zaprosić na randkę, ale boi się odrzucenia.",filler27,,,,,filler,sensible,filler27
1,Katastrofa Dominiki bardzo dotknęła Wojtka.,Wojtek wlazł na łóżko Dominiki i zawinął się w prześcieradło.,filler9,,,,,noun,nonsensible,filler9
2,Lilka zaprzyjaźniła się z Marianką.,Lubiły bawić się razem lalkami.,filler37,,,,,filler,sensible,filler37
3,Bartek z wściekłością wyrzucił Maćka z pokoju.,"On zawsze strasznie hałasował, gdy Bartek chciał się skoncentrować.",noncentered,0.0,52.0,18.0,10.0,pronoun,9,target
4,Kacper zabrał Sebastiana na wycieczkę.,Sebastianowi podobała się ich wspólna wyprawa.,filler21,,,,,filler,sensible,filler21
5,Marysia pozmywała naczynia za Sonię.,"Sonia musi się nauczyć, żeby nie obciążać swoimi obowiązkami Marysi.",noncentered,1.0,101.0,19.0,0.0,noun,17,target
6,Tymon chodził na korepetycje z Krystianem.,Jego mama robiła pyszne obiady dla Krystiana.,filler15,,,,,pronoun,nonsensible,filler15
7,Sonia pożyczyła rower od Niny.,"Miała później wyrzuty sumienia, ponieważ w drodze do pracy Sonię potrącił samochód.",noncentered,0.0,171.0,27.0,19.0,null,29,target
8,Jan nie był w stanie wysłać Tadkowi czeku.,"On był tak dumny, że Tadek mógł to zrobić.",filler1,,,,,pronoun,nonsensible,filler1
9,Paweł uczył Paulinę jeździć na łyżwach.,Dlatego poszli na lodowisko.,filler39,,,,,filler,sensible,filler39
10,Staś próbował zrobić ulubiony tort Doroty.,"Najlepiej wychodziły mu hamburgery, których Dorota nie lubiła.",filler12,,,,,pronoun,nonsensible,filler12
11,Staś pomógł Adamowi myć samochód.,"Wiedział, że prawdopodobnie Staś będzie chciał zapłatę.",noncentered,0.0,81.0,15.0,8.0,null,14,target
12,Teresa wrzuciła do skrytki Marty banknot.,"Ona była zawsze umalowana, czego zazdrościła jej Marta.",filler5,,,,,pronoun,nonsensible,filler5
13,Maja urodziła dziecko Rafałowi.,Oboje byli bardzo szczęśliwi.,filler35,,,,,filler,sensible,filler35
14,Witold postanowił ścigać się z Mikołajem.,"On nie był dziś w formie, a mimo to udało mu się wygrać z Mikołajem.",centered,1.0,127.0,22.0,19.0,pronoun,22,target
15,Agnieszka pomagała w lekcjach Adamowi.,"Gdyby nie Agnieszka, Adam by chodził w porwanych skarpetkach.",filler16,,,,,noun,nonsensible,filler16
16,"Paula wiedziała, na co może liczyć ze strony Łucji.",Dla niej najważniejszy był ulubiony grzebień Łucji.,filler3,,,,,pronoun,nonsensible,filler3
17,Aniela znalazła pracę w firmie Bartka.,Zawsze lubili razem pracować.,filler36,,,,,filler,sensible,filler36
18,Tomek znalazł w szatni zeszyt Kuby.,On nie mógł go znaleźć od tygodnia i teraz był wdzięczny Tomkowi.,noncentered,1.0,22.0,18.0,16.0,pronoun,4,target
19,Dawid marzył o dorównaniu Paulinie.,"Gdy Dawid wchodził po schodach, Paulina patrzyła uważnie.",filler10,,,,,noun,nonsensible,filler10
20,Kasia straciła zaufanie do Janiny.,"Gdyby nie jej torebka, to Janina miałaby więcej szczęścia.",filler2,,,,,pronoun,nonsensible,filler2
21,Jacek szczerze przeprosił Piotra.,Piotr był wyraźnie urażony wypowiedzią Jacka.,noncentered,1.0,5.0,15.0,0.0,noun,1,target
22,Olek znowu zdradził Franciszkę.,Nie mogła sobie z tym poradzić.,filler38,,,,,filler,sensible,filler38
23,Grażyna przesłała e-mailem Klarze podziękowania.,"Klara nie wiedziała, co powinna odpowiedzieć Grażynie.",noncentered,1.0,29.0,16.0,0.0,noun,5,target
24,Kaczor Donald był ulubionym gościem Myszki Miki.,Uwielbiali spędzać ze sobą czas.,filler32,,,,,filler,sensible,filler32
25,Marcin nie lubi pracować z Hubertem.,"Często bardzo się złości, gdy Marcin stara się mu pomóc.",noncentered,0.0,93.0,14.0,8.0,null,16,target
26,Marek kopnął w nogę Ziemowita.,Największe dzieło Marka podobało się najbardziej Ziemowitowi.,filler7,,,,,noun,nonsensible,filler7
27,Marzena często komplementowała Zosię.,"Ona aż promieniała, gdy Marzena ją chwaliła.",noncentered,0.0,10.0,15.0,7.0,pronoun,2,target
28,Mateusz zaraził się grypą od Adriana.,Żaden z nich nie był zaszczepiony.,filler29,,,,,filler,sensible,filler29
29,Michał zadzwonił wcześnie rano do Karola.,"Michał miał ważną sprawę, dlatego chciał szybko skontaktować się z Karolem.",centered,1.0,56.0,22.0,0.0,noun,10,target
30,Grzegorz naprawił ulubiony zegar Jana.,Jego firanki nigdy nie miały dla Jana znaczenia.,filler4,,,,,pronoun,nonsensible,filler4
31,Asia znalazła na strychu stary pamiętnik Ewy.,"Ewa, pamiętając, co kiedyś o niej napisała, nie mogła zdobyć się na rozmowę z Asią.",noncentered,1.0,65.0,28.0,0.0,noun,11,target
32,Adrian zawsze liczył się ze zdaniem Gosi.,"Uważał, że ona ma naprawdę fantastyczny gust.",filler34,,,,,filler,sensible,filler34
33,Wiktor uścisnął na koniec dłoń Pawła.,"On zastanawiał się, czy to dobrze, że sprzedał Wiktorowi motocykl.",noncentered,0.0,40.0,20.0,13.0,pronoun,7,target
34,Marcin starał się uspokoić Magdalenę.,"Dla Marcina w miarę postępów było coraz jaśniejsze, dlaczego to Magdalena.",filler8,,,,,noun,nonsensible,filler8
35,Ala wysłała Kasię do sklepu po zakupy.,Ona w tym czasie przygotowywała dla Kasi niespodziankę.,centered,0.0,73.0,19.0,13.0,pronoun,13,target
36,Dla Radka najważniejsze było bezpieczeństwo Oli.,Dlatego wysłał ją na kurs samoobrony.,filler22,,,,,filler,sensible,filler22
37,Daria wybrała się razem z Kingą na wyprawę górską.,"Zastanawia się, czy spanie w szałasie nie będzie zbyt uciążliwe dla Kingi.",centered,1.0,144.0,23.0,21.0,null,25,target
38,Tadeusz codziennie pisał wiersze dla Marii.,Według niego najważniejsze było śpiewanie piosenek dla Marii.,filler13,,,,,pronoun,nonsensible,filler13
39,Klemens gotował razem z Heleną obiad.,Niestety zagapili się i przypaliła im się zupa.,filler24,,,,,filler,sensible,filler24
40,Tomek zaplanował wyjazd z Magdą.,"Jakby Tomek nie zjadł pączka, to Magda nie byłaby zła.",filler17,,,,,noun,nonsensible,filler17
41,Lena nie jest w stanie skontaktować się z Klarą.,"Przynajmniej od tygodnia ma zepsuty telefon, więc nie może zadzwonić do Klary.",centered,1.0,156.0,24.0,22.0,null,27,target
42,Zuzia była najlepszą przyjaciółką Justyny.,Wszystko robiły razem i zawsze były ze sobą zgodne.,filler28,,,,,filler,sensible,filler28
43,Hania zgubiła podczas wycieczki złote kolczyki Julii.,"Julia będzie musiała przyznać się mamie, że pożyczyła kolczyki Hani.",noncentered,1.0,107.0,22.0,0.0,noun,18,target
44,Gracjan jest największym fanem The Chainsmokers.,Chodził na wszystkie ich koncerty.,filler33,,,,,filler,sensible,filler33
45,Igor usiadł w ławce razem z Albertem.,"On był zadowolony, że się udało, bo zawsze bardzo dobrze mu się pracowało z Igorem.",noncentered,1.0,154.0,29.0,26.0,pronoun,26,target
46,Szczepan poszedł na imprezę z Olą.,Według Szczepana najlepszą jajecznicę robiła Ola.,filler19,,,,,noun,nonsensible,filler19
47,Olga przepisałą pracę domową od Ani.,"Ona nie podejrzewała, jakie nieprzyjemności będzie miała z tego powodu Ania.",centered,1.0,133.0,27.0,25.0,pronoun,23,target
48,Klara zawsze wytrącała Jagodę z równowagi.,Klara nigdy nie spóźniała się na korepetycje u Jagody.,filler6,,,,,noun,nonsensible,filler6
49,Jurek bardzo pokłócił się z Leszkiem.,"Nie mógł zrozumieć, dlaczego nie może przekonać Jurka do swojego zdania.",noncentered,0.0,141.0,23.0,15.0,null,24,target
50,Prosiaczek był najlepszym przyjacielem Puchatka.,On lubił podjadać miodek Puchatka.,filler14,,,,,pronoun,nonsensible,filler14
51,Adrian przeczytał wiadomość od Kacpra.,"Adrian nie może jednak wyjść z pracy wcześniej, by spotkać się teraz z Kacprem.",centered,1.0,164.0,22.0,0.0,noun,28,target
52,Zosia nie potrafiła doradzić Lucynie.,Problem ten był dla niej zbyt skomplikowany.,filler25,,,,,filler,sensible,filler25
53,Konrad umówił się z Błażejem pod sklepem.,"Siedział pod sklepem godzinę, jednak nie doczekał się Błażeja.",centered,1.0,174.0,18.0,15.0,null,30,target
54,Wojtek przepisał od Andrzeja pracę domową.,Niestety nauczyciel przyłapał ich na oszustwie.,filler26,,,,,filler,sensible,filler26
55,Basia w sekrecie powiedziała Oli o wypadku.,"Wie, że nie dotrzymała tajemnicy, wszystko mówiąc Oli.",centered,1.0,114.0,17.0,15.0,null,20,target
56,Mikołaj co roku przynosił prezenty Tosi.,On bardzo lubił pleść Tosi warkocze.,filler11,,,,,pronoun,nonsensible,filler11
57,Werka pogłaskała Łatkę po głowie.,"Werka często tak robiła, gdy zostawiała Łatkę samą w domu.",centered,0.0,44.0,20.0,0.0,noun,8,target
58,Irena odziedziczyła cały spadek po Konradzie.,Stała się z dnia na dzień obrzydliwie bogata.,filler30,,,,,filler,sensible,filler30
59,Rafał często znęcał się nad Grzesiem.,Rafał przez całą drogę do domu przedrzeźniał Grzesia.,centered,1.0,68.0,15.0,0.0,noun,12,target
60,Damian nie potrafił zaimponować Sylwii.,Jego zaloty w ogóle na nią nie działały.,filler31,,,,,filler,sensible,filler31
61,Ada wyszła z Krysią na spacer.,"Zebrała się wreszcie na odwagę, by wszystko wyznać Krysi.",centered,1.0,120.0,15.0,17.0,null,21,target
62,Zrozpaczona Zosia przytuliła się do Maćka.,Zosia zawsze miała dobry humor przy Maćku.,filler20,,,,,noun,nonsensible,filler20
63,Marta kupiła Natalii wielki bukiet róż.,"Była zaskoczona, że choć się nie lubią, to Marta zdobyła się na taki gest.",noncentered,0.0,87.0,21.0,13.0,null,15,target
64,Krzysztof postanowił zrobić remont w mieszkaniu Dominiki.,"Gdyby nie Krzysztof, to Dominika poszłaby spać.",filler18,,,,,noun,nonsensible,filler18
65,Sylwia w gniewie zepchnęła Malwinę ze schodów.,"Ona była wstrząśnięta tym, że Malwina przespała się z jej mężem.",centered,0.0,31.0,19.0,9.0,pronoun,6,target
66,Ula pomogła sprzątnąć dom Mariuszowi.,Sam by sobie nie poradził z tym bałaganem.,filler40,,,,,filler,sensible,filler40
67,Darek zobaczył Wojtka przy przejściu dla pieszych.,"Darek zamachał energicznie, by zwrócić uwagę Wojtka.",centered,1.0,110.0,19.0,0.0,noun,19,target
68,Staś zawsze podziwiał Rafała.,Był dla niego kimś w rodzaju starszego brata.,filler23,,,,,filler,sensible,filler23
69,Jan wygrał tym razem w szachy z Krzysztofem.,On był znacznie silniejszym graczem niż Krzysztof.,centered,1.0,13.0,13.0,10.0,pronoun,3,target
